{
  "case_id": "prettier-jest-snapshot-babel-v2-001",
  "context_method": "drain3-templates",
  "diagnoser": "copilot-sol-compat",
  "mode": "root_cause_diagnosis",
  "summary": "The Jest run failed in three formatting test suites: two suites had parser-error snapshot mismatches, and one Babel TypeScript conformance test unexpectedly threw a syntax error. Overall, 14 tests and 13 snapshots failed.",
  "root_cause_category": "test_assertion",
  "root_cause": "Parser diagnostics produced by the current code no longer match the committed Jest snapshots, including changed messages for invalid import expressions and ambient TypeScript declarations; additionally, the babel-ts constructor-overload case now rejects a parameter initializer.",
  "confidence": 0.98,
  "relevant_files": [
    "tests/format/js/_errors_/import/format.test.js",
    "tests/config/format-test/test-format.js",
    "tests/format/typescript/conformance/classes/constructorDeclarations/constructorParameters/format.test.js",
    "src/common/parser-create-error.js",
    "src/language-js/parse/utilities/create-babel-parse-error.js",
    "src/language-js/parse/babel.js",
    "src/main/parse.js",
    "tests/format/typescript/_errors_/declare-function-with-body/format.test.js"
  ],
  "relevant_tests": [
    "snippet: <*> <*> 1",
    "constructorOverloadsWithDefaultValues.ts > format[babel-ts]"
  ],
  "evidence": [
    {
      "quote": "FAIL tests/format/js/_errors_/import/format.test.js",
      "reason": "Identifies a failing JavaScript error-formatting suite."
    },
    {
      "quote": "Error: expect(received).rejects.toThrowErrorMatchingSnapshot()",
      "reason": "Shows that an expected parser-error snapshot did not match the received error."
    },
    {
      "quote": "- Unexpected token <*>",
      "reason": "Shows the error text stored in the snapshot."
    },
    {
      "quote": "+ `import()` requires exactly one or two arguments. <*>",
      "reason": "Shows the changed parser diagnostic that caused the snapshot mismatch."
    },
    {
      "quote": "FAIL tests/format/typescript/conformance/classes/constructorDeclarations/constructorParameters/format.test.js",
      "reason": "Identifies the failing TypeScript conformance suite."
    },
    {
      "quote": "constructorOverloadsWithDefaultValues.ts > format[babel-ts]",
      "reason": "Identifies the specific failing Babel TypeScript test."
    },
    {
      "quote": "SyntaxError: A parameter initializer is only allowed in a function or constructor implementation. (3:17)",
      "reason": "States why the babel-ts conformance case failed to parse."
    },
    {
      "quote": "FAIL tests/format/typescript/_errors_/declare-function-with-body/format.test.js",
      "reason": "Identifies the second failing parser-error snapshot suite."
    },
    {
      "quote": "Snapshot Summary",
      "reason": "Introduces Jest's aggregate snapshot failure report."
    },
    {
      "quote": "› 13 snapshots failed from 2 test suites. Inspect your code changes or re-run jest with `-u` to update them.",
      "reason": "Confirms that snapshot mismatches account for 13 failures and supplies the supported remediation command."
    },
    {
      "quote": "Test Suites: 3 failed, 1500 passed, 1503 total",
      "reason": "Confirms the final extent of the test-suite failure."
    }
  ],
  "suggested_fix": "Inspect whether the new parser diagnostics and babel-ts rejection are intended; if they are, re-run Jest with `-u` to update the 13 snapshots and adjust the constructor-overload conformance expectation, otherwise restore the prior parser behavior.",
  "input": {
    "context_path": "results/v2/holdout/drain3-templates/prettier-jest-snapshot-babel-v2-001.txt",
    "context_tokens_estimate": 48250
  },
  "usage": {
    "processing_tokens_estimate": 0,
    "output_tokens_estimate": 1181
  },
  "metadata": {
    "provider": "command",
    "prompt_sha256": "ecffdf03c99a91b0f8f75e086720d9fb8db96af0d9dae5285baf679c9c9d28de",
    "runtime_ms": 12590.088,
    "cache_key": "872796a05d93cf47c2132fd911793bc692eaf4e9e18b543bb10c4954b905766e",
    "provider_error": null,
    "provider_error_detail": null,
    "command": "python3 examples/diagnosis_shim_copilot_cli.py",
    "model_info": {
      "provider_name": "github-copilot",
      "requested_model": "gpt-5.6-sol",
      "resolved_model": "gpt-5.6-sol",
      "cli_version": "GitHub Copilot CLI 1.0.82.",
      "reasoning_effort_requested": "low",
      "context_mode": "default",
      "max_context_chars": 480000,
      "tools_available": 0,
      "custom_instructions": false,
      "isolated_copilot_home": true,
      "model_version": "gpt-5.6-sol",
      "max_context_window_tokens": 400000,
      "max_prompt_tokens_capability": 272000,
      "tokenizer": "o200k_base",
      "reasoning_effort_resolved": "low",
      "max_prompt_tokens": 272000,
      "tool_count": 0,
      "usage": {
        "completion_tokens": 788,
        "prompt_tokens": 78495,
        "total_tokens": 79283,
        "prompt_tokens_details": {
          "cached_tokens": 0,
          "cache_creation_tokens": 78492,
          "cache_ttl_seconds": 1800
        },
        "completion_tokens_details": {
          "reasoning_tokens": 0
        },
        "prompt_cache_frontier_source": "reported_writes",
        "prompt_cache_details_reported": true
      },
      "observable_ai_usage": {
        "token_details": [
          {
            "batch_size": 1000000,
            "cost_per_batch": 200000000000,
            "token_count": 3,
            "token_type": "input"
          },
          {
            "batch_size": 1000000,
            "cost_per_batch": 20000000000,
            "token_count": 0,
            "token_type": "cache_read"
          },
          {
            "batch_size": 1000000,
            "cost_per_batch": 250000000000,
            "token_count": 78492,
            "token_type": "cache_write"
          },
          {
            "batch_size": 1000000,
            "cost_per_batch": 1000000000000,
            "token_count": 788,
            "token_type": "output"
          }
        ],
        "total_nano_aiu": 20411600000
      },
      "model_call_duration_ms": 8107,
      "cli_result_usage": {
        "premiumRequests": 1,
        "totalApiDurationMs": 8107,
        "sessionDurationMs": 10306,
        "codeChanges": {
          "linesAdded": 0,
          "linesRemoved": 0,
          "filesModified": []
        }
      }
    },
    "diagnoser_config_name": null,
    "diagnoser_config_sha256": "3090010e6a2b4cd862c8e6ea3be6bd0ee9862c034dd9aeba1cf79bbf8c6ffd5f",
    "shim_sha256": "a37d5d679110ef731a856ca5e77080715cf6f82e330c7a8896e0332869b8243a"
  }
}
