{
  "case_id": "pip-pytest-network-github-v2-001",
  "context_method": "tail",
  "diagnoser": "real-debugger-v2",
  "mode": "root_cause_diagnosis",
  "summary": "The test `test_no_truststore_can_install[GitHub]` failed because pip could not download a package from GitHub during the test run. GitHub returned repeated 502 errors, exhausting all retries. This is a transient network failure, not a code defect.",
  "root_cause_category": "network_or_flaky",
  "root_cause": "GitHub's servers returned repeated 502 responses when pip attempted to download `https://github.com/pypa/pip-test-package/archive/refs/heads/master.zip`, causing `Max retries exceeded` and a non-zero exit code that failed the test assertion.",
  "confidence": 0.95,
  "relevant_files": [
    "tests/functional/test_truststore.py",
    "tests/lib/__init__.py"
  ],
  "relevant_tests": [
    "tests/functional/test_truststore.py::test_no_truststore_can_install[GitHub]"
  ],
  "evidence": [
    {
      "quote": "ERROR: Could not install packages due to an OSError: HTTPSConnectionPool(host='github.com', port=443): Max retries exceeded with url: /pypa/pip-test-package/archive/refs/heads/master.zip (Caused by ResponseError('too many 502 error responses'))",
      "reason": "Explicitly shows the network failure: GitHub returned 502 responses until retries were exhausted, which is a transient server-side error."
    },
    {
      "quote": "RERUN tests/functional/test_truststore.py::test_no_truststore_can_install[GitHub]\nRERUN tests/functional/test_truststore.py::test_no_truststore_can_install[GitHub]\nRERUN tests/functional/test_truststore.py::test_no_truststore_can_install[GitHub]",
      "reason": "The test was retried three times and failed each time, confirming a persistent transient network condition rather than a deterministic code bug."
    },
    {
      "quote": "FAILED tests/functional/test_truststore.py::test_no_truststore_can_install[GitHub] - AssertionError: Script returned code: 1",
      "reason": "The sole failing test is the one that contacts GitHub, and its failure is an AssertionError triggered by the non-zero return code caused by the network error."
    },
    {
      "quote": "args       = ('python', '-m', 'pip', 'install', 'https://github.com/pypa/pip-test-package/archive/refs/heads/master.zip', '--use-deprecated=legacy-certs')",
      "reason": "Confirms the test exercise requires a live outbound HTTPS connection to github.com, making it susceptible to external network failures."
    }
  ],
  "suggested_fix": "Re-run the failed job; the 502 errors from GitHub are transient. Consider adding retry logic or marking this test with a network-flaky marker so it is automatically re-run on network failures without failing the entire CI run.",
  "input": {
    "context_path": "results/v2/dev/tail/pip-pytest-network-github-v2-001.txt",
    "context_tokens_estimate": 5900
  },
  "usage": {
    "processing_tokens_estimate": 0,
    "output_tokens_estimate": 622
  },
  "metadata": {
    "provider": "command",
    "prompt_sha256": "ecffdf03c99a91b0f8f75e086720d9fb8db96af0d9dae5285baf679c9c9d28de",
    "runtime_ms": 22401.508,
    "cache_key": "7b92facbb562f8e99cfa5f07d2c94d2e848e275c570da81b96ab6868fd302d9d",
    "provider_error": null,
    "command": "python3 /Users/eyuansu62/llm_judge/cli-token-killer/cilog-bench/examples/diagnosis_shim_claude_cli.py",
    "model_info": {
      "provider_name": "anthropic",
      "requested_model": "sonnet",
      "requested_model_canonical": "claude-sonnet-4-6",
      "resolved_model": null,
      "usage": null,
      "session_id": null,
      "_backfilled": true,
      "_backfill_note": "Pre-Codex-2026-05-14 F2 fix. The Claude shim now persists _model_info from every API call; this row predates that emit so resolved_model and usage are not recoverable. requested_model is set to the shim-level alias (haiku for v1, sonnet for v2) which is what the post-fix shim emits."
    }
  }
}
