{
  "case_id": "docs-transformers-001",
  "context_method": "llm-summary-v1-haiku",
  "diagnoser": "real-debugger-v1",
  "mode": "root_cause_diagnosis",
  "summary": "A Python syntax error halted the documentation build step due to an unresolved git merge conflict marker `<<<<<<< sonic-moe` embedded in transformers/modeling_utils.py at line 1974.",
  "root_cause_category": "compile_error",
  "root_cause": "Unresolved git merge conflict marker in transformers/modeling_utils.py:1974 prevents Python parser from interpreting the file as valid syntax.",
  "confidence": 0.95,
  "relevant_files": [
    "transformers/modeling_utils.py"
  ],
  "relevant_tests": [
    "build_pr_documentation"
  ],
  "evidence": [
    {
      "quote": "SyntaxError: invalid syntax",
      "reason": "Confirms Python parser encountered syntax error during file parsing"
    },
    {
      "quote": "<<<<<<< sonic-moe",
      "reason": "Git merge conflict marker is present in the source file and is invalid Python syntax"
    },
    {
      "quote": "File \"/home/runner/work/transformers/transformers/.venv/lib/python3.10/site-packages/transformers/modeling_utils.py\", line 1974",
      "reason": "Stack trace pinpoints exact location of the syntax error"
    },
    {
      "quote": "exit code 1",
      "reason": "Confirms the step failed with error exit code"
    }
  ],
  "suggested_fix": "Resolve the git merge conflict in transformers/modeling_utils.py by deciding which version to keep (sonic-moe or the merge source), remove all conflict markers (<<<<<<, =======, >>>>>>>), and commit the resolved file before re-running CI.",
  "input": {
    "context_path": "results/holdout/llm-summary-v1-haiku/docs-transformers-001.txt",
    "context_tokens_estimate": 440
  },
  "usage": {
    "processing_tokens_estimate": 0,
    "output_tokens_estimate": 336
  },
  "metadata": {
    "provider": "command",
    "prompt_sha256": "ecffdf03c99a91b0f8f75e086720d9fb8db96af0d9dae5285baf679c9c9d28de",
    "runtime_ms": 29903.896,
    "cache_key": "c45053bd2c4acd320c5adb06b66395bd2a100a641c180c5cfcb85a64f69cbd0b",
    "provider_error": null,
    "command": "python3 /Users/eyuansu62/llm_judge/cli-token-killer/cilog-bench/examples/diagnosis_shim_claude_cli.py",
    "model_info": {
      "provider_name": "anthropic",
      "requested_model": "haiku",
      "requested_model_canonical": "claude-haiku-4-5",
      "resolved_model": null,
      "usage": null,
      "session_id": null,
      "_backfilled": true,
      "_backfill_note": "Pre-Codex-2026-05-14 F2 fix. The Claude shim now persists _model_info from every API call; this row predates that emit so resolved_model and usage are not recoverable. requested_model is set to the shim-level alias (haiku for v1, sonnet for v2) which is what the post-fix shim emits."
    },
    "diagnoser_config_sha256": "ade4ac2160bff920d4d00a0acc2289b3e3cf8de3a70e06ecd399e7cb5a0bb356",
    "shim_sha256": "c0bd17c0508b7e1dc7b535aca4b1d1c0da0e61d7a203dccdeb4be0690168ddf7"
  }
}
