{
  "case_id": "cleanup-k8s-stress-001",
  "context_method": "hybrid-grep-120k-tail-v2",
  "diagnoser": "real-debugger-v1",
  "mode": "root_cause_diagnosis",
  "summary": "The 'Cleanup artifacts' job failed when attempting to delete artifacts using the GitHub CLI (gh command). The gh command returned a 403 Forbidden error, indicating the integration lacks permission to access or delete the artifacts.",
  "root_cause_category": "permission_or_secret",
  "root_cause": "GitHub Actions integration does not have permission to delete artifacts. The gh command received HTTP 403 (Resource not accessible by integration) when attempting to delete artifacts for the run.",
  "confidence": 0.9,
  "relevant_files": [],
  "relevant_tests": [],
  "evidence": [
    {
      "quote": "gh: Resource not accessible by integration (HTTP 403)",
      "reason": "Explicit HTTP 403 Forbidden error from GitHub CLI indicates insufficient authentication or authorization for artifact deletion"
    },
    {
      "quote": "Deleting artifacts for run ID: 23485708914",
      "reason": "Shows the job was attempting to delete artifacts when the permission error occurred"
    },
    {
      "quote": "Process completed with exit code 1",
      "reason": "Confirms the process failed due to the permission error"
    }
  ],
  "suggested_fix": "Ensure the GitHub Actions workflow uses a token with appropriate permissions for artifact deletion. Verify that the GITHUB_TOKEN has the necessary scopes (e.g., 'actions: write') or consider using a Personal Access Token (PAT) with artifact management permissions.",
  "input": {
    "context_path": "results/stress/hybrid-grep-120k-tail-v2/cleanup-k8s-stress-001.txt",
    "context_tokens_estimate": 127
  },
  "usage": {
    "processing_tokens_estimate": 0,
    "output_tokens_estimate": 337
  },
  "metadata": {
    "provider": "command",
    "prompt_sha256": "ecffdf03c99a91b0f8f75e086720d9fb8db96af0d9dae5285baf679c9c9d28de",
    "runtime_ms": 17538.759,
    "cache_key": "17d5842de20edbf2b0fcaf0280ae473862181df90e733b5977fca54a0fbe1387",
    "provider_error": null,
    "command": "python3 /Users/eyuansu62/llm_judge/cli-token-killer/cilog-bench/examples/diagnosis_shim_claude_cli.py",
    "model_info": {
      "provider_name": "anthropic",
      "requested_model": "haiku",
      "requested_model_canonical": "claude-haiku-4-5",
      "resolved_model": null,
      "usage": null,
      "session_id": null,
      "_backfilled": true,
      "_backfill_note": "Pre-Codex-2026-05-14 F2 fix. The Claude shim now persists _model_info from every API call; this row predates that emit so resolved_model and usage are not recoverable. requested_model is set to the shim-level alias (haiku for v1, sonnet for v2) which is what the post-fix shim emits."
    }
  }
}
