{
  "case_id": "pytest-pandas-001",
  "context_method": "hybrid-grep-120k-tail-v2",
  "diagnoser": "copilot-sol-compat",
  "mode": "root_cause_diagnosis",
  "summary": "The NumPy Nightly pytest run failed because constructing bare `np.datetime64(\"NaT\")` values now emits a `DeprecationWarning`, which is treated as an error during collection and test execution. The run ended with 45 failed tests and 52 collection errors.",
  "root_cause_category": "test_assertion",
  "root_cause": "Tests and pandas code construct datetime or timedelta NaT values without a specific unit, causing NumPy's generic-unit DeprecationWarning to fail the pytest run.",
  "confidence": 0.99,
  "relevant_files": [
    "pandas/core/internals/concat.py",
    "pandas/tests/arrays/masked/test_indexing.py",
    "pandas/tests/arrays/test_timedeltas.py",
    "pandas/tests/arithmetic/test_datetime64.py",
    "pandas/tests/arithmetic/test_timedelta64.py",
    "pandas/tests/dtypes/test_inference.py",
    "pandas/tests/dtypes/test_missing.py",
    "pandas/tests/frame/indexing/test_indexing.py",
    "pandas/tests/frame/methods/test_rank.py",
    "pandas/tests/frame/test_constructors.py",
    "pandas/tests/groupby/methods/test_nth.py",
    "pandas/tests/indexes/categorical/test_indexing.py",
    "pandas/tests/indexes/datetimes/methods/test_insert.py",
    "pandas/tests/indexes/datetimes/test_indexing.py",
    "pandas/tests/indexes/test_index_new.py",
    "pandas/tests/indexes/timedeltas/methods/test_insert.py",
    "pandas/tests/indexes/timedeltas/test_indexing.py",
    "pandas/tests/io/json/test_ujson.py",
    "pandas/tests/io/sas/test_sas7bdat.py",
    "pandas/tests/reshape/concat/test_append.py",
    "pandas/tests/reshape/concat/test_categorical.py",
    "pandas/tests/reshape/concat/test_datetimes.py",
    "pandas/tests/scalar/timedelta/test_arithmetic.py",
    "pandas/tests/scalar/timestamp/test_constructors.py",
    "pandas/tests/series/indexing/test_indexing.py",
    "pandas/tests/series/methods/test_equals.py",
    "pandas/tests/test_algos.py",
    "pandas/tests/tools/test_to_datetime.py",
    "pandas/tests/tslibs/test_array_to_datetime.py",
    "pandas/tests/util/test_assert_almost_equal.py",
    "pandas/tests/util/test_assert_index_equal.py"
  ],
  "relevant_tests": [
    "TestDatetimeIndexComparisons.test_dti_cmp_nat_behaves_like_float_cmp_nan",
    "TestAppend.test_append_dtype_coerce[True]",
    "TestAppend.test_append_dtype_coerce[False]",
    "TestCategoricalConcat.test_concat_categorical_datetime",
    "TestTimedeltaAdditionSubtraction.test_td_rsub_nat",
    "TestTimedeltaMultiplicationDivision.test_td_rdiv_na_scalar",
    "TestGetLoc.test_get_loc_nat",
    "TestTimedeltaIndexInsert.test_insert_invalid_na",
    "test_concat_datetime64_different_resolutions",
    "test_equals_matching_nas",
    "test_nullable_integer_to_datetime",
    "test_assert_index_equal_different_inferred_types",
    "test_first_categorical_and_datetime_data_nat",
    "test_null_date"
  ],
  "evidence": [
    {
      "quote": "E   DeprecationWarning: The 'generic' unit for NumPy timedelta is deprecated, and will raise an error in the future. This includes implicit conversion of bare integers (e.g. `+ 1`).Please use a specific unit instead.",
      "reason": "This explicitly identifies the warning responsible for collection errors and states that a specific unit is required."
    },
    {
      "quote": "np.datetime64(\"NaT\")",
      "reason": "This bare NaT construction is repeatedly highlighted as the expression triggering the warning."
    },
    {
      "quote": ">           return dtype.type(\"NaT\")",
      "reason": "This identifies a production-code occurrence in the concat path that also creates a generic-unit NaT."
    },
    {
      "quote": "pandas/core/internals/concat.py:412: DeprecationWarning",
      "reason": "This locates one non-test source of the same warning."
    },
    {
      "quote": "= 45 failed, 162298 passed, 25570 skipped, 701 xfailed, 52 errors in 759.43s (0:12:39) =",
      "reason": "This confirms that the warning produced both runtime test failures and collection errors."
    },
    {
      "quote": "##[error]Process completed with exit code 1.",
      "reason": "This confirms the warning-related pytest failures caused the CI job to fail."
    }
  ],
  "suggested_fix": "Replace bare generic-unit NaT constructions such as `np.datetime64(\"NaT\")` and `dtype.type(\"NaT\")` with constructions that explicitly specify the appropriate datetime or timedelta unit.",
  "input": {
    "context_path": "results/dev/hybrid-grep-120k-tail-v2/pytest-pandas-001.txt",
    "context_tokens_estimate": 81147
  },
  "usage": {
    "processing_tokens_estimate": 0,
    "output_tokens_estimate": 1404
  },
  "metadata": {
    "provider": "command",
    "prompt_sha256": "ecffdf03c99a91b0f8f75e086720d9fb8db96af0d9dae5285baf679c9c9d28de",
    "runtime_ms": 15365.154,
    "cache_key": "4ec5fce527b705a2b1fa95388f94859709152c6b78bfc51b037c185468a1e08d",
    "provider_error": null,
    "provider_error_detail": null,
    "command": "python3 examples/diagnosis_shim_copilot_cli.py",
    "model_info": {
      "provider_name": "github-copilot",
      "requested_model": "gpt-5.6-sol",
      "resolved_model": "gpt-5.6-sol",
      "cli_version": "GitHub Copilot CLI 1.0.82.",
      "reasoning_effort_requested": "low",
      "context_mode": "default",
      "max_context_chars": 480000,
      "tools_available": 0,
      "custom_instructions": false,
      "isolated_copilot_home": true,
      "model_version": "gpt-5.6-sol",
      "max_context_window_tokens": 400000,
      "max_prompt_tokens_capability": 272000,
      "tokenizer": "o200k_base",
      "reasoning_effort_resolved": "low",
      "max_prompt_tokens": 272000,
      "tool_count": 0,
      "usage": {
        "completion_tokens": 1150,
        "prompt_tokens": 79078,
        "total_tokens": 80228,
        "prompt_tokens_details": {
          "cached_tokens": 0,
          "cache_creation_tokens": 79075,
          "cache_ttl_seconds": 1800
        },
        "completion_tokens_details": {
          "reasoning_tokens": 65
        },
        "prompt_cache_frontier_source": "reported_writes",
        "prompt_cache_details_reported": true
      },
      "observable_ai_usage": {
        "token_details": [
          {
            "batch_size": 1000000,
            "cost_per_batch": 200000000000,
            "token_count": 3,
            "token_type": "input"
          },
          {
            "batch_size": 1000000,
            "cost_per_batch": 20000000000,
            "token_count": 0,
            "token_type": "cache_read"
          },
          {
            "batch_size": 1000000,
            "cost_per_batch": 250000000000,
            "token_count": 79075,
            "token_type": "cache_write"
          },
          {
            "batch_size": 1000000,
            "cost_per_batch": 1000000000000,
            "token_count": 1150,
            "token_type": "output"
          }
        ],
        "total_nano_aiu": 20919350000
      },
      "model_call_duration_ms": 11162,
      "cli_result_usage": {
        "premiumRequests": 1,
        "totalApiDurationMs": 11162,
        "sessionDurationMs": 13264,
        "codeChanges": {
          "linesAdded": 0,
          "linesRemoved": 0,
          "filesModified": []
        }
      }
    },
    "diagnoser_config_name": null,
    "diagnoser_config_sha256": "3090010e6a2b4cd862c8e6ea3be6bd0ee9862c034dd9aeba1cf79bbf8c6ffd5f",
    "shim_sha256": "a37d5d679110ef731a856ca5e77080715cf6f82e330c7a8896e0332869b8243a"
  }
}
