{
  "case_id": "gradle-projecthealth-batch5-v2-001",
  "context_method": "grep",
  "diagnoser": "real-debugger-v3",
  "mode": "root_cause_diagnosis",
  "summary": "The Gradle build failed because the projectHealth check detected a dependency configuration that must be changed in platform-base's build script.",
  "root_cause_category": "other",
  "root_cause": "The project health check ':platform-base:projectHealth' reported that the dependency on projects.domainObjectCollections is declared with 'api' but should be 'implementation' in platform-base's build.gradle.kts.",
  "confidence": 0.85,
  "relevant_files": [
    "/home/runner/work/gradle/gradle/platforms/software/platform-base/build.gradle.kts"
  ],
  "relevant_tests": [
    ":platform-base:projectHealth"
  ],
  "evidence": [
    {
      "quote": "Execution failed for task ':platform-base:projectHealth'.",
      "reason": "Identifies the specific Gradle task that failed."
    },
    {
      "quote": "/home/runner/work/gradle/gradle/platforms/software/platform-base/build.gradle.kts",
      "reason": "Shows the build script file referenced by the failure."
    },
    {
      "quote": "Existing dependencies which should be modified to be as indicated:",
      "reason": "Indicates the project health check found dependencies that must be modified."
    },
    {
      "quote": "implementation(projects.domainObjectCollections) (was api)",
      "reason": "Specifies the exact dependency configuration change required by the check."
    }
  ],
  "suggested_fix": "In /home/runner/work/gradle/gradle/platforms/software/platform-base/build.gradle.kts, change the dependency declaration from api(projects.domainObjectCollections) to implementation(projects.domainObjectCollections) (or otherwise align the configuration as indicated by the projectHealth check), then re-run the build.",
  "input": {
    "context_path": "results/v2/holdout/grep/gradle-projecthealth-batch5-v2-001.txt",
    "context_tokens_estimate": 8928
  },
  "usage": {
    "processing_tokens_estimate": 0,
    "output_tokens_estimate": 395
  },
  "metadata": {
    "provider": "command",
    "prompt_sha256": "ecffdf03c99a91b0f8f75e086720d9fb8db96af0d9dae5285baf679c9c9d28de",
    "runtime_ms": 13045.507,
    "cache_key": "96fb220f0aedc9e107f26d4d6cdf218f7527ac3d84c3f01df225429e44bdf595",
    "provider_error": null,
    "command": "python3 /Users/eyuansu62/llm_judge/cli-token-killer/cilog-bench/examples/diagnosis_shim_openai.py",
    "model_info": {
      "provider_name": "openai",
      "requested_model": "gpt-5-mini",
      "resolved_model": null,
      "base_url": "https://api.openai.com/v1",
      "max_completion_tokens": 4096,
      "system_fingerprint": null,
      "usage": null,
      "_backfilled": true,
      "_backfill_note": "Pre-Codex-2026-05-11 F2 fix the shim didn't persist model_info into rows. This entry was backfilled from known run-time env: CILOGBENCH_OPENAI_MODEL=gpt-5-mini, default base_url, default max_completion_tokens=4096. resolved_model and system_fingerprint are not recoverable from the original API responses."
    }
  }
}
