{
  "case_id": "gh-cli-go-test-prompter-v2-001",
  "context_method": "raw",
  "diagnoser": "copilot-sol-native-long",
  "mode": "root_cause_diagnosis",
  "summary": "The Go test suite failed because a prompter test timed out while waiting for form.Run() to complete.",
  "root_cause_category": "test_assertion",
  "root_cause": "TestHuhPrompterMultiSelectWithSearchPersistence/selections_persist_after_changing_search_query failed because form.Run() did not complete within the test's allotted time.",
  "confidence": 0.98,
  "relevant_files": [
    "huh_prompter_test.go"
  ],
  "relevant_tests": [
    "TestHuhPrompterMultiSelectWithSearchPersistence",
    "TestHuhPrompterMultiSelectWithSearchPersistence/selections_persist_after_changing_search_query"
  ],
  "evidence": [
    {
      "quote": "--- FAIL: TestHuhPrompterMultiSelectWithSearchPersistence (5.19s)",
      "reason": "Identifies the failing test."
    },
    {
      "quote": "--- FAIL: TestHuhPrompterMultiSelectWithSearchPersistence/selections_persist_after_changing_search_query (5.13s)",
      "reason": "Identifies the specific failing subtest."
    },
    {
      "quote": "huh_prompter_test.go:478: form.Run() did not complete in time",
      "reason": "States the concrete failure and source location."
    },
    {
      "quote": "FAIL\tgithub.com/cli/cli/v2/internal/prompter\t8.475s",
      "reason": "Confirms that the prompter package failed."
    }
  ],
  "suggested_fix": "Inspect huh_prompter_test.go at line 478 and fix the form interaction or synchronization so form.Run() completes within the test timeout.",
  "input": {
    "context_path": "results/v2/holdout/raw/gh-cli-go-test-prompter-v2-001.txt",
    "context_tokens_estimate": 11367
  },
  "usage": {
    "processing_tokens_estimate": 0,
    "output_tokens_estimate": 700
  },
  "metadata": {
    "provider": "command",
    "prompt_sha256": "ecffdf03c99a91b0f8f75e086720d9fb8db96af0d9dae5285baf679c9c9d28de",
    "runtime_ms": 8537.545,
    "cache_key": "a69c9f9b6eea3dd6d59d7406027cada35997b67256f2885d19a9d8f4615de43d",
    "provider_error": null,
    "provider_error_detail": null,
    "command": "/tmp/logdx-copilot-sdk-1.0.11/bin/python examples/diagnosis_shim_copilot_sdk.py",
    "model_info": {
      "provider_name": "github-copilot",
      "requested_model": "gpt-5.6-sol",
      "resolved_model": "gpt-5.6-sol",
      "model_version": "gpt-5.6-sol",
      "sdk_version": "1.0.11",
      "cli_version": "1.0.79",
      "transport": "copilot-sdk-jsonrpc",
      "reasoning_effort_requested": "low",
      "reasoning_effort_resolved": "low",
      "context_mode": "long_context",
      "context_tier": "long_context",
      "max_context_window_tokens": 1050000,
      "max_prompt_tokens_capability": 922000,
      "max_prompt_tokens": 922000,
      "safe_prompt_token_cap": 921000,
      "tokenizer": "o200k_base",
      "prompt_tokens_counted": 21195,
      "tools_available": 0,
      "tool_count": 0,
      "custom_instructions": false,
      "memory_enabled": false,
      "infinite_sessions_enabled": false,
      "session_store_enabled": false,
      "isolated_copilot_home": true,
      "usage": {
        "prompt_tokens": 21242,
        "completion_tokens": 314,
        "total_tokens": 21556,
        "cache_read_tokens": 0,
        "cache_write_tokens": 21239,
        "reasoning_tokens": 0
      },
      "observable_ai_usage": {
        "token_details": [
          {
            "batch_size": 1000000,
            "cost_per_batch": 200000000000,
            "token_count": 3,
            "token_type": "input"
          },
          {
            "batch_size": 1000000,
            "cost_per_batch": 20000000000,
            "token_count": 0,
            "token_type": "cache_read"
          },
          {
            "batch_size": 1000000,
            "cost_per_batch": 250000000000,
            "token_count": 21239,
            "token_type": "cache_write"
          },
          {
            "batch_size": 1000000,
            "cost_per_batch": 1000000000000,
            "token_count": 314,
            "token_type": "output"
          }
        ],
        "total_nano_aiu": 5624350000.0
      },
      "model_call_duration_ms": 4060.0,
      "sdk_session_duration_ms": 8022.957
    },
    "diagnoser_config_name": null,
    "diagnoser_config_sha256": "a09cffdb0080fd5a74d1c98c506233c8017c674e856dafa2f52e288452048a83",
    "shim_sha256": "20143deadb8e3e22cda32c4e86ca19be802af9e8c5b09620953aa597cc834ccc"
  }
}
