{
  "case_id": "cleanup-k8s-stress-001",
  "context_method": "llm-summary-v1-haiku",
  "diagnoser": "real-debugger-v1",
  "mode": "root_cause_diagnosis",
  "summary": "The GitHub Actions workflow's `gh` command failed with HTTP 403 (Forbidden), indicating the integration lacks sufficient permissions to access a required resource during the cleanup job.",
  "root_cause_category": "permission_or_secret",
  "root_cause": "The GitHub Actions integration or token used by the workflow does not have sufficient permissions to access the resource being queried by the `gh` command.",
  "confidence": 0.85,
  "relevant_files": [],
  "relevant_tests": [],
  "evidence": [
    {
      "quote": "gh: Resource not accessible by integration (HTTP 403)",
      "reason": "Explicit error message showing the GitHub CLI integration was denied access to a resource due to insufficient permissions"
    },
    {
      "quote": "##[error]Process completed with exit code 1.",
      "reason": "Confirms the job failed due to the gh command error"
    }
  ],
  "suggested_fix": "Verify that the GitHub Actions integration token has the required permissions (check GITHUB_TOKEN scopes or grant appropriate scopes to any Personal Access Token being used) for the resource the `gh` command is attempting to access",
  "input": {
    "context_path": "results/stress/llm-summary-v1-haiku/cleanup-k8s-stress-001.txt",
    "context_tokens_estimate": 302
  },
  "usage": {
    "processing_tokens_estimate": 0,
    "output_tokens_estimate": 270
  },
  "metadata": {
    "provider": "command",
    "prompt_sha256": "ecffdf03c99a91b0f8f75e086720d9fb8db96af0d9dae5285baf679c9c9d28de",
    "runtime_ms": 27336.445,
    "cache_key": "472ff9aea9756fa5454ebb546ab2726757f9332361f7a19a1018094caeab060a",
    "provider_error": null,
    "command": "python3 /Users/eyuansu62/llm_judge/cli-token-killer/cilog-bench/examples/diagnosis_shim_claude_cli.py"
  }
}
