{
  "case_id": "tsc-typescript-001",
  "context_method": "raw",
  "diagnoser": "stub-debugger-v1",
  "mode": "root_cause_diagnosis",
  "summary": "A runtime test failed. (stub shim; pattern '^FAILED\\\\s|--- FAIL:|AssertionError|DeprecationWarning' on raw context)",
  "root_cause_category": "test_assertion",
  "root_cause": "A runtime test failed.",
  "confidence": 0.55,
  "relevant_files": [],
  "relevant_tests": [],
  "evidence": [
    {
      "quote": "2026-04-19T17:23:25.7020621Z      AssertionError: expected 'Add return type \\'Foo<string>\\'' to equal 'Add return type \\'Foo<string, string[…'",
      "reason": "Matched pattern for test_assertion."
    }
  ],
  "suggested_fix": "",
  "input": {
    "context_path": "results/holdout/raw/tsc-typescript-001.txt",
    "context_tokens_estimate": 7239
  },
  "usage": {
    "processing_tokens_estimate": 0,
    "output_tokens_estimate": 131
  },
  "metadata": {
    "provider": "command",
    "prompt_sha256": "ecffdf03c99a91b0f8f75e086720d9fb8db96af0d9dae5285baf679c9c9d28de",
    "runtime_ms": 117.543,
    "cache_key": "19f82dd0e4008c2959e7b41e4f90a1dc2c99f38f0fb81f86080cf358a566cdb5",
    "provider_error": null,
    "command": "python3 /Users/eyuansu62/llm_judge/cli-token-killer/cilog-bench/examples/diagnosis_shim_stub.py"
  }
}
