{
  "case_id": "cleanup-k8s-stress-001",
  "context_method": "hybrid-grep-120k-rtk-tail-v3",
  "diagnoser": "copilot-luna-compat",
  "mode": "root_cause_diagnosis",
  "summary": "The Cleanup artifacts job failed while attempting to delete artifacts for run ID 23485708914. GitHub CLI returned HTTP 403 because the integration was not authorized to access the resource.",
  "root_cause_category": "permission_or_secret",
  "root_cause": "The artifact deletion operation lacked sufficient GitHub integration permissions, producing \"Resource not accessible by integration (HTTP 403)\" and exit code 1.",
  "confidence": 0.99,
  "relevant_files": [],
  "relevant_tests": [],
  "evidence": [
    {
      "quote": "Deleting artifacts for run ID: 23485708914",
      "reason": "Identifies the operation that was being performed when the job failed."
    },
    {
      "quote": "gh: Resource not accessible by integration (HTTP 403)",
      "reason": "Explicitly indicates an authorization failure from the GitHub CLI."
    },
    {
      "quote": "Process completed with exit code 1.",
      "reason": "Confirms the authorization error caused the job to fail."
    }
  ],
  "suggested_fix": "Grant the GitHub integration or token used by the cleanup job permission to access and delete artifacts, then rerun the job.",
  "input": {
    "context_path": "results/stress/hybrid-grep-120k-rtk-tail-v3/cleanup-k8s-stress-001.txt",
    "context_tokens_estimate": 128
  },
  "usage": {
    "processing_tokens_estimate": 0,
    "output_tokens_estimate": 660
  },
  "metadata": {
    "provider": "command",
    "prompt_sha256": "ecffdf03c99a91b0f8f75e086720d9fb8db96af0d9dae5285baf679c9c9d28de",
    "runtime_ms": 13046.764,
    "cache_key": "c82f84566a803ebcad00d0f1c8597f56e6ea9f0e00e18fa05b94d0b41f5bfa5f",
    "provider_error": null,
    "provider_error_detail": null,
    "command": "python3 examples/diagnosis_shim_copilot_cli.py",
    "model_info": {
      "provider_name": "github-copilot",
      "requested_model": "gpt-5.6-luna",
      "resolved_model": "gpt-5.6-luna",
      "cli_version": "GitHub Copilot CLI 1.0.82.",
      "reasoning_effort_requested": "low",
      "context_mode": "default",
      "max_context_chars": 480000,
      "tools_available": 0,
      "custom_instructions": false,
      "isolated_copilot_home": true,
      "model_version": "gpt-5.6-luna",
      "max_context_window_tokens": 328000,
      "max_prompt_tokens_capability": 200000,
      "tokenizer": "o200k_base",
      "reasoning_effort_resolved": "low",
      "max_prompt_tokens": 200000,
      "tool_count": 0,
      "usage": {
        "completion_tokens": 222,
        "prompt_tokens": 5285,
        "total_tokens": 5507,
        "prompt_tokens_details": {
          "cached_tokens": 0,
          "cache_creation_tokens": 5282,
          "cache_ttl_seconds": 1800
        },
        "completion_tokens_details": {
          "reasoning_tokens": 0
        },
        "prompt_cache_frontier_source": "reported_writes",
        "prompt_cache_details_reported": true
      },
      "observable_ai_usage": {
        "token_details": [
          {
            "batch_size": 1000000,
            "cost_per_batch": 20000000000,
            "token_count": 3,
            "token_type": "input"
          },
          {
            "batch_size": 1000000,
            "cost_per_batch": 2000000000,
            "token_count": 0,
            "token_type": "cache_read"
          },
          {
            "batch_size": 1000000,
            "cost_per_batch": 25000000000,
            "token_count": 5282,
            "token_type": "cache_write"
          },
          {
            "batch_size": 1000000,
            "cost_per_batch": 120000000000,
            "token_count": 222,
            "token_type": "output"
          }
        ],
        "total_nano_aiu": 158750000
      },
      "model_call_duration_ms": 3170,
      "cli_result_usage": {
        "premiumRequests": 1,
        "totalApiDurationMs": 3170,
        "sessionDurationMs": 7356,
        "codeChanges": {
          "linesAdded": 0,
          "linesRemoved": 0,
          "filesModified": []
        }
      }
    },
    "diagnoser_config_name": null,
    "diagnoser_config_sha256": "2a2cf91740e2aa5e108dd27e6e9bffbf57cd0b09704b4be470b254c35c421f60",
    "shim_sha256": "a37d5d679110ef731a856ca5e77080715cf6f82e330c7a8896e0332869b8243a"
  }
}
