{
  "case_id": "pushpr-nextjs-001",
  "context_method": "raw",
  "diagnoser": "copilot-terra-compat",
  "mode": "root_cause_diagnosis",
  "summary": "The sync-react job completed dependency installation and vendored React builds, then failed when it tried to push the update branch. GitHub rejected the authenticated bot identity with HTTP 403.",
  "root_cause_category": "permission_or_secret",
  "root_cause": "The credentials used by nextjs-bot do not have permission to push update/react/19.3.0-canary-142cfde8-20260422 to vercel/next.js.",
  "confidence": 0.99,
  "relevant_files": [
    "scripts/sync-react.js"
  ],
  "relevant_tests": [],
  "evidence": [
    {
      "quote": "Error: Command failed with exit code 128 (Unknown system error -128): git push origin update/react/19.3.0-canary-142cfde8-20260422",
      "reason": "The failing command is explicitly the push of the React update branch."
    },
    {
      "quote": "remote: Permission to vercel/next.js.git denied to nextjs-bot.",
      "reason": "GitHub explicitly identifies insufficient permission for the bot account."
    },
    {
      "quote": "fatal: unable to access 'https://github.com/vercel/next.js/': The requested URL returned error: 403",
      "reason": "The remote returned an authorization failure."
    }
  ],
  "suggested_fix": "Grant the credentials used by nextjs-bot permission to push branches to vercel/next.js, or configure the workflow to use credentials with that permission.",
  "input": {
    "context_path": "results/holdout/raw/pushpr-nextjs-001.txt",
    "context_tokens_estimate": 18936
  },
  "usage": {
    "processing_tokens_estimate": 0,
    "output_tokens_estimate": 709
  },
  "metadata": {
    "provider": "command",
    "prompt_sha256": "ecffdf03c99a91b0f8f75e086720d9fb8db96af0d9dae5285baf679c9c9d28de",
    "runtime_ms": 8594.554,
    "cache_key": "62a04f44552ed172d4803919fceba65d213fa46304406f161c5d3d389518e659",
    "provider_error": null,
    "provider_error_detail": null,
    "command": "python3 examples/diagnosis_shim_copilot_cli.py",
    "model_info": {
      "provider_name": "github-copilot",
      "requested_model": "gpt-5.6-terra",
      "resolved_model": "gpt-5.6-terra",
      "cli_version": "GitHub Copilot CLI 1.0.82.",
      "reasoning_effort_requested": "low",
      "context_mode": "default",
      "max_context_chars": 480000,
      "tools_available": 0,
      "custom_instructions": false,
      "isolated_copilot_home": true,
      "model_version": "gpt-5.6-terra",
      "max_context_window_tokens": 400000,
      "max_prompt_tokens_capability": 272000,
      "tokenizer": "o200k_base",
      "reasoning_effort_resolved": "low",
      "max_prompt_tokens": 272000,
      "tool_count": 0,
      "usage": {
        "completion_tokens": 287,
        "prompt_tokens": 39842,
        "total_tokens": 40129,
        "prompt_tokens_details": {
          "cached_tokens": 0,
          "cache_creation_tokens": 39839,
          "cache_ttl_seconds": 1800
        },
        "completion_tokens_details": {
          "reasoning_tokens": 0
        },
        "prompt_cache_frontier_source": "reported_writes",
        "prompt_cache_details_reported": true
      },
      "observable_ai_usage": {
        "token_details": [
          {
            "batch_size": 1000000,
            "cost_per_batch": 200000000000,
            "token_count": 3,
            "token_type": "input"
          },
          {
            "batch_size": 1000000,
            "cost_per_batch": 20000000000,
            "token_count": 0,
            "token_type": "cache_read"
          },
          {
            "batch_size": 1000000,
            "cost_per_batch": 250000000000,
            "token_count": 39839,
            "token_type": "cache_write"
          },
          {
            "batch_size": 1000000,
            "cost_per_batch": 1200000000000,
            "token_count": 287,
            "token_type": "output"
          }
        ],
        "total_nano_aiu": 10304750000
      },
      "model_call_duration_ms": 4015,
      "cli_result_usage": {
        "premiumRequests": 1,
        "totalApiDurationMs": 4015,
        "sessionDurationMs": 6394,
        "codeChanges": {
          "linesAdded": 0,
          "linesRemoved": 0,
          "filesModified": []
        }
      }
    },
    "diagnoser_config_name": null,
    "diagnoser_config_sha256": "8f61ec33e3622c22e900ffd4fc8e99928ba589ac7a15055ae59b431c5f2f5afe",
    "shim_sha256": "a37d5d679110ef731a856ca5e77080715cf6f82e330c7a8896e0332869b8243a"
  }
}
