{
  "case_id": "docs-transformers-001",
  "context_method": "tail",
  "diagnoser": "copilot-terra-compat",
  "mode": "root_cause_diagnosis",
  "summary": "The documentation build failed while converting the Llama model documentation because importing the Transformers Llama module encountered an unresolved merge-conflict marker in Python source.",
  "root_cause_category": "compile_error",
  "root_cause": "transformers/modeling_utils.py contains the invalid Python merge-conflict marker \"<<<<<<< sonic-moe\" at line 1974, causing a SyntaxError during the documentation build.",
  "confidence": 0.98,
  "relevant_files": [
    "transformers/modeling_utils.py",
    "../transformers/docs/source/en/model_doc/llama.md"
  ],
  "relevant_tests": [],
  "evidence": [
    {
      "quote": "File \"/home/runner/work/transformers/transformers/.venv/lib/python3.10/site-packages/transformers/modeling_utils.py\", line 1974",
      "reason": "The traceback identifies the Python file and exact line where parsing failed."
    },
    {
      "quote": "<<<<<<< sonic-moe",
      "reason": "This is an unresolved Git merge-conflict marker and is not valid Python syntax."
    },
    {
      "quote": "SyntaxError: invalid syntax",
      "reason": "Python explicitly reports the syntax failure."
    },
    {
      "quote": "SyntaxError: There was an error when converting ../transformers/docs/source/en/model_doc/llama.md to the MDX format.",
      "reason": "The doc-builder reports that the invalid import prevented conversion of the Llama documentation."
    },
    {
      "quote": "##[error]Process completed with exit code 1.",
      "reason": "The failed documentation-build process caused the CI job to fail."
    }
  ],
  "suggested_fix": "Resolve and remove the merge-conflict marker \"<<<<<<< sonic-moe\" and its corresponding conflict sections in transformers/modeling_utils.py, then rerun the documentation build.",
  "input": {
    "context_path": "results/holdout/tail/docs-transformers-001.txt",
    "context_tokens_estimate": 4250
  },
  "usage": {
    "processing_tokens_estimate": 0,
    "output_tokens_estimate": 806
  },
  "metadata": {
    "provider": "command",
    "prompt_sha256": "ecffdf03c99a91b0f8f75e086720d9fb8db96af0d9dae5285baf679c9c9d28de",
    "runtime_ms": 8590.827,
    "cache_key": "30ca409a46e0a9a36361a6c736105d1dab69dc25454c7f24fcf7aa3f26519645",
    "provider_error": null,
    "provider_error_detail": null,
    "command": "python3 examples/diagnosis_shim_copilot_cli.py",
    "model_info": {
      "provider_name": "github-copilot",
      "requested_model": "gpt-5.6-terra",
      "resolved_model": "gpt-5.6-terra",
      "cli_version": "GitHub Copilot CLI 1.0.82.",
      "reasoning_effort_requested": "low",
      "context_mode": "default",
      "max_context_chars": 480000,
      "tools_available": 0,
      "custom_instructions": false,
      "isolated_copilot_home": true,
      "model_version": "gpt-5.6-terra",
      "max_context_window_tokens": 400000,
      "max_prompt_tokens_capability": 272000,
      "tokenizer": "o200k_base",
      "reasoning_effort_resolved": "low",
      "max_prompt_tokens": 272000,
      "tool_count": 0,
      "usage": {
        "completion_tokens": 411,
        "prompt_tokens": 12215,
        "total_tokens": 12626,
        "prompt_tokens_details": {
          "cached_tokens": 0,
          "cache_creation_tokens": 12212,
          "cache_ttl_seconds": 1800
        },
        "completion_tokens_details": {
          "reasoning_tokens": 0
        },
        "prompt_cache_frontier_source": "reported_writes",
        "prompt_cache_details_reported": true
      },
      "observable_ai_usage": {
        "token_details": [
          {
            "batch_size": 1000000,
            "cost_per_batch": 200000000000,
            "token_count": 3,
            "token_type": "input"
          },
          {
            "batch_size": 1000000,
            "cost_per_batch": 20000000000,
            "token_count": 0,
            "token_type": "cache_read"
          },
          {
            "batch_size": 1000000,
            "cost_per_batch": 250000000000,
            "token_count": 12212,
            "token_type": "cache_write"
          },
          {
            "batch_size": 1000000,
            "cost_per_batch": 1200000000000,
            "token_count": 411,
            "token_type": "output"
          }
        ],
        "total_nano_aiu": 3546800000
      },
      "model_call_duration_ms": 4447,
      "cli_result_usage": {
        "premiumRequests": 1,
        "totalApiDurationMs": 4447,
        "sessionDurationMs": 6798,
        "codeChanges": {
          "linesAdded": 0,
          "linesRemoved": 0,
          "filesModified": []
        }
      }
    },
    "diagnoser_config_name": null,
    "diagnoser_config_sha256": "8f61ec33e3622c22e900ffd4fc8e99928ba589ac7a15055ae59b431c5f2f5afe",
    "shim_sha256": "a37d5d679110ef731a856ca5e77080715cf6f82e330c7a8896e0332869b8243a"
  }
}
