{
  "case_id": "lint-react-001",
  "context_method": "raw",
  "diagnoser": "real-debugger-v3",
  "mode": "root_cause_diagnosis",
  "summary": "Prettier formatting check failed: one file is not formatted according to the project's Prettier rules.",
  "root_cause_category": "formatting_failure",
  "root_cause": "The prettier check failed because packages/react-dom/src/__tests__/ReactDOMFragmentRefs-test.js is not formatted; the prettier script exited with a non-zero status.",
  "confidence": 0.86,
  "relevant_files": [
    "packages/react-dom/src/__tests__/ReactDOMFragmentRefs-test.js"
  ],
  "relevant_tests": [
    "yarn prettier-check",
    "node ./scripts/prettier/index.js"
  ],
  "evidence": [
    {
      "quote": "Please run yarn prettier-all and add changes to files listed below to your commit:",
      "reason": "The CI output explicitly instructs to run yarn prettier-all to fix formatting issues."
    },
    {
      "quote": "packages/react-dom/src/__tests__/ReactDOMFragmentRefs-test.js",
      "reason": "This file is listed by the prettier script as needing formatting."
    },
    {
      "quote": "error Command failed with exit code 1.",
      "reason": "The prettier-check command failed and returned a non-zero exit code, causing the job to fail."
    },
    {
      "quote": "$ node ./scripts/prettier/index.js",
      "reason": "Shows which script was run to perform the prettier check."
    },
    {
      "quote": "yarn prettier-check",
      "reason": "Indicates the CI step that invoked the prettier formatting check."
    }
  ],
  "suggested_fix": "Run the project's formatting script locally (yarn prettier-all), commit the resulting changes (including packages/react-dom/src/__tests__/ReactDOMFragmentRefs-test.js), and push the commit so the prettier-check step passes.",
  "input": {
    "context_path": "results/dev/raw/lint-react-001.txt",
    "context_tokens_estimate": 7054
  },
  "usage": {
    "processing_tokens_estimate": 0,
    "output_tokens_estimate": 532
  },
  "metadata": {
    "provider": "command",
    "prompt_sha256": "ecffdf03c99a91b0f8f75e086720d9fb8db96af0d9dae5285baf679c9c9d28de",
    "runtime_ms": 11859.866,
    "cache_key": "26b60d74402212d5ba51817efd067106b2eede28d6025331c7417f073f500111",
    "provider_error": null,
    "command": "python3 /Users/eyuansu62/llm_judge/cli-token-killer/cilog-bench/examples/diagnosis_shim_openai.py",
    "model_info": {
      "provider_name": "openai",
      "requested_model": "gpt-5-mini",
      "resolved_model": "gpt-5-mini-2025-08-07",
      "base_url": "https://api.openai.com/v1",
      "base_url_sha256": "d9617135d6fdd0a2cde722d637a1dfcc3da37515708b3ea5d66ae607c8ac785e",
      "max_completion_tokens": 4096,
      "system_fingerprint": null,
      "usage": {
        "prompt_tokens": 12323,
        "completion_tokens": 720,
        "total_tokens": 13043,
        "prompt_tokens_details": {
          "cached_tokens": 0,
          "audio_tokens": 0
        },
        "completion_tokens_details": {
          "reasoning_tokens": 320,
          "audio_tokens": 0,
          "accepted_prediction_tokens": 0,
          "rejected_prediction_tokens": 0
        }
      }
    }
  }
}
