{
  "case_id": "nodejs-test-debugger-exec-timeout-v2-001",
  "context_method": "raw",
  "diagnoser": "copilot-terra-compat",
  "mode": "root_cause_diagnosis",
  "summary": "Diagnoser failed. See metadata.provider_error.",
  "root_cause_category": "unknown",
  "root_cause": "unknown",
  "confidence": 0.0,
  "relevant_files": [],
  "relevant_tests": [],
  "evidence": [],
  "suggested_fix": "",
  "input": {
    "context_path": "results/v2/stress/raw/nodejs-test-debugger-exec-timeout-v2-001.txt",
    "context_tokens_estimate": 1277256
  },
  "usage": {
    "processing_tokens_estimate": 0,
    "output_tokens_estimate": 81
  },
  "metadata": {
    "provider": "command",
    "prompt_sha256": "ecffdf03c99a91b0f8f75e086720d9fb8db96af0d9dae5285baf679c9c9d28de",
    "runtime_ms": 75.319,
    "cache_key": "212d3a9246f96e2f5deeac539beae43cfa37a087584e857a679df046dbd9dcf7",
    "provider_error": "unsupported_context_too_large: context (5109024 chars) exceeds shim cap (480000)",
    "provider_error_detail": "ShimCallError: diagnosis command exited 1: ",
    "command": "python3 examples/diagnosis_shim_copilot_cli.py",
    "model_info": null,
    "diagnoser_config_name": null,
    "diagnoser_config_sha256": "8f61ec33e3622c22e900ffd4fc8e99928ba589ac7a15055ae59b431c5f2f5afe",
    "shim_sha256": "a37d5d679110ef731a856ca5e77080715cf6f82e330c7a8896e0332869b8243a"
  }
}
