{
  "case_id": "pytest-sklearn-stress-001",
  "context_method": "hybrid-grep-120k-rtk-tail-v3",
  "diagnoser": "copilot-luna-compat",
  "mode": "root_cause_diagnosis",
  "summary": "The main pytest suite passed, but the documentation doctest stage failed because the expected output in callbacks.rst did not match the actual output.",
  "root_cause_category": "test_assertion",
  "root_cause": "The doctest in callbacks.rst failed at line 48: it expected no output, but the command produced `LogisticRegression()`.",
  "confidence": 0.99,
  "relevant_files": [
    "/home/runner/work/scikit-learn/scikit-learn/doc/callbacks.rst"
  ],
  "relevant_tests": [
    "callbacks.rst::callbacks.rst"
  ],
  "evidence": [
    {
      "quote": "___________________________ [doctest] callbacks.rst ____________________________",
      "reason": "Identifies the failing documentation doctest."
    },
    {
      "quote": "Got:\n2026-04-23T11:20:00.6878490Z     LogisticRegression()",
      "reason": "Shows the actual output that caused the doctest mismatch."
    },
    {
      "quote": "/home/runner/work/scikit-learn/scikit-learn/doc/callbacks.rst:48: DocTestFailure",
      "reason": "Pinpoints the failure location."
    },
    {
      "quote": "FAILED ../doc/callbacks.rst::callbacks.rst",
      "reason": "Confirms the documentation test failed."
    }
  ],
  "suggested_fix": "Update the doctest in doc/callbacks.rst around line 48 so its expected output matches `LogisticRegression()`, or suppress that output if it is not intended to be documented.",
  "input": {
    "context_path": "results/stress/hybrid-grep-120k-rtk-tail-v3/pytest-sklearn-stress-001.txt",
    "context_tokens_estimate": 5594
  },
  "usage": {
    "processing_tokens_estimate": 0,
    "output_tokens_estimate": 709
  },
  "metadata": {
    "provider": "command",
    "prompt_sha256": "ecffdf03c99a91b0f8f75e086720d9fb8db96af0d9dae5285baf679c9c9d28de",
    "runtime_ms": 7088.922,
    "cache_key": "51bce6c730d1c77aba6244e477f1d5ece69881d0c0675f14f27b5d50cc113495",
    "provider_error": null,
    "provider_error_detail": null,
    "command": "python3 examples/diagnosis_shim_copilot_cli.py",
    "model_info": {
      "provider_name": "github-copilot",
      "requested_model": "gpt-5.6-luna",
      "resolved_model": "gpt-5.6-luna",
      "cli_version": "GitHub Copilot CLI 1.0.82.",
      "reasoning_effort_requested": "low",
      "context_mode": "default",
      "max_context_chars": 480000,
      "tools_available": 0,
      "custom_instructions": false,
      "isolated_copilot_home": true,
      "model_version": "gpt-5.6-luna",
      "max_context_window_tokens": 328000,
      "max_prompt_tokens_capability": 200000,
      "tokenizer": "o200k_base",
      "reasoning_effort_resolved": "low",
      "max_prompt_tokens": 200000,
      "tool_count": 0,
      "usage": {
        "completion_tokens": 364,
        "prompt_tokens": 16583,
        "total_tokens": 16947,
        "prompt_tokens_details": {
          "cached_tokens": 0,
          "cache_creation_tokens": 16580,
          "cache_ttl_seconds": 1800
        },
        "completion_tokens_details": {
          "reasoning_tokens": 0
        },
        "prompt_cache_frontier_source": "reported_writes",
        "prompt_cache_details_reported": true
      },
      "observable_ai_usage": {
        "token_details": [
          {
            "batch_size": 1000000,
            "cost_per_batch": 20000000000,
            "token_count": 3,
            "token_type": "input"
          },
          {
            "batch_size": 1000000,
            "cost_per_batch": 2000000000,
            "token_count": 0,
            "token_type": "cache_read"
          },
          {
            "batch_size": 1000000,
            "cost_per_batch": 25000000000,
            "token_count": 16580,
            "token_type": "cache_write"
          },
          {
            "batch_size": 1000000,
            "cost_per_batch": 120000000000,
            "token_count": 364,
            "token_type": "output"
          }
        ],
        "total_nano_aiu": 458240000
      },
      "model_call_duration_ms": 3303,
      "cli_result_usage": {
        "premiumRequests": 1,
        "totalApiDurationMs": 3303,
        "sessionDurationMs": 5093,
        "codeChanges": {
          "linesAdded": 0,
          "linesRemoved": 0,
          "filesModified": []
        }
      }
    },
    "diagnoser_config_name": null,
    "diagnoser_config_sha256": "2a2cf91740e2aa5e108dd27e6e9bffbf57cd0b09704b4be470b254c35c421f60",
    "shim_sha256": "a37d5d679110ef731a856ca5e77080715cf6f82e330c7a8896e0332869b8243a"
  }
}
