{
  "case_id": "cpython-tcl-windows-matrix-v2-001",
  "context_method": "hybrid-grep-120k-tail-v2",
  "diagnoser": "real-debugger-v1",
  "mode": "root_cause_diagnosis",
  "summary": "Diagnoser failed. See metadata.provider_error.",
  "root_cause_category": "unknown",
  "root_cause": "unknown",
  "confidence": 0.0,
  "relevant_files": [],
  "relevant_tests": [],
  "evidence": [],
  "suggested_fix": "",
  "input": {
    "context_path": "results/v2/stress/hybrid-grep-120k-tail-v2/cpython-tcl-windows-matrix-v2-001.txt",
    "context_tokens_estimate": 73559
  },
  "usage": {
    "processing_tokens_estimate": 0,
    "output_tokens_estimate": 55
  },
  "metadata": {
    "provider": "command",
    "prompt_sha256": "ecffdf03c99a91b0f8f75e086720d9fb8db96af0d9dae5285baf679c9c9d28de",
    "runtime_ms": 9543.88,
    "cache_key": "ff1df7c44f8f3cffe1cd48950edc791260f08f73fabc465f6bede8f556715006",
    "provider_error": "RuntimeError: claude CLI exited 1: ''",
    "command": "python3 /Users/eyuansu62/llm_judge/cli-token-killer/cilog-bench/examples/diagnosis_shim_claude_cli.py",
    "model_info": {
      "provider_name": "anthropic",
      "requested_model": "haiku",
      "requested_model_canonical": "claude-haiku-4-5",
      "resolved_model": null,
      "usage": null,
      "session_id": null,
      "_backfilled": true,
      "_backfill_note": "Pre-Codex-2026-05-14 F2 fix. The Claude shim now persists _model_info from every API call; this row predates that emit so resolved_model and usage are not recoverable. requested_model is set to the shim-level alias (haiku for v1, sonnet for v2) which is what the post-fix shim emits."
    },
    "provider_error_detail": "RuntimeError: diagnosis command exited 1: diagnosis_shim_claude_cli: RuntimeError: claude CLI exited 1: ''\n"
  }
}
