{
  "case_id": "prettier-react-stress-001",
  "context_method": "rtk-read",
  "diagnoser": "real-debugger-v3",
  "mode": "root_cause_diagnosis",
  "summary": "The Prettier check failed because some files are not formatted. The job printed the files that need formatting and exited with a non-zero status.",
  "root_cause_category": "formatting_failure",
  "root_cause": "Prettier reported unformatted files and exited with code 1; the output lists packages/react-dom/src/__tests__/ReactDOMFragmentRefs-test.js and compiler/packages/babel-plugin-react-compiler/src/ReactiveScopes/CodegenReactiveFunction.ts as needing formatting.",
  "confidence": 0.88,
  "relevant_files": [
    "packages/react-dom/src/__tests__/ReactDOMFragmentRefs-test.js",
    "compiler/packages/babel-plugin-react-compiler/src/ReactiveScopes/CodegenReactiveFunction.ts"
  ],
  "relevant_tests": [
    "yarn prettier-check",
    "node ./scripts/prettier/index.js",
    "Run prettier"
  ],
  "evidence": [
    {
      "quote": "This project uses prettier to format all JavaScript code.",
      "reason": "Shows the job is running a Prettier formatting check."
    },
    {
      "quote": "Please run yarn prettier-all and add changes to files listed below to your commit:",
      "reason": "Prettier instructs to run the formatting command, indicating files failed the check."
    },
    {
      "quote": "packages/react-dom/src/__tests__/ReactDOMFragmentRefs-test.js",
      "reason": "This file is listed by the Prettier script as needing formatting."
    },
    {
      "quote": "compiler/packages/babel-plugin-react-compiler/src/ReactiveScopes/CodegenReactiveFunction.ts",
      "reason": "This file is listed by the Prettier script as needing formatting."
    },
    {
      "quote": "error Command failed with exit code 1.",
      "reason": "The Prettier check exited non-zero, causing the CI job to fail."
    }
  ],
  "suggested_fix": "Run the suggested formatter: execute yarn prettier-all (or run node ./scripts/prettier/index.js with the formatting command) locally or in CI to format the listed files, commit the changes, and re-run the workflow.",
  "input": {
    "context_path": "results/stress/rtk-read/prettier-react-stress-001.txt",
    "context_tokens_estimate": 4470
  },
  "usage": {
    "processing_tokens_estimate": 0,
    "output_tokens_estimate": 607
  },
  "metadata": {
    "provider": "command",
    "prompt_sha256": "ecffdf03c99a91b0f8f75e086720d9fb8db96af0d9dae5285baf679c9c9d28de",
    "runtime_ms": 14372.102,
    "cache_key": "95cfc88cc11733b0507f401429bd18783d421ad1eab1beb41d50a9ddde1cc8f1",
    "provider_error": null,
    "command": "python3 /Users/eyuansu62/llm_judge/cli-token-killer/cilog-bench/examples/diagnosis_shim_openai.py",
    "model_info": {
      "provider_name": "openai",
      "requested_model": "gpt-5-mini",
      "resolved_model": "gpt-5-mini-2025-08-07",
      "base_url": "https://api.openai.com/v1",
      "base_url_sha256": "d9617135d6fdd0a2cde722d637a1dfcc3da37515708b3ea5d66ae607c8ac785e",
      "max_completion_tokens": 4096,
      "system_fingerprint": null,
      "usage": {
        "prompt_tokens": 8462,
        "completion_tokens": 1308,
        "total_tokens": 9770,
        "prompt_tokens_details": {
          "cached_tokens": 8064,
          "audio_tokens": 0
        },
        "completion_tokens_details": {
          "reasoning_tokens": 832,
          "audio_tokens": 0,
          "accepted_prediction_tokens": 0,
          "rejected_prediction_tokens": 0
        }
      }
    }
  }
}
